{
  "motif_id": "phase_gadget_3t",
  "description": "Phase gadget with 3 targets",
  "source": "hand_crafted",
  "tags": ["phase_gadget", "t_gate"],
  "graph": {
    "nodes": [
      {"id": 0, "vertex_type": "Z", "phase_class": "t_like", "is_boundary": false},
      {"id": 1, "vertex_type": "Z", "phase_class": "zero", "is_boundary": false},
      {"id": 2, "vertex_type": "Z", "phase_class": "zero", "is_boundary": false},
      {"id": 3, "vertex_type": "Z", "phase_class": "zero", "is_boundary": false},
      {"id": 4, "vertex_type": "Z", "phase_class": "zero", "is_boundary": false}
    ],
    "links": [
      {"source": 0, "target": 1, "edge_type": "HADAMARD"},
      {"source": 1, "target": 2, "edge_type": "HADAMARD"},
      {"source": 1, "target": 3, "edge_type": "HADAMARD"},
      {"source": 1, "target": 4, "edge_type": "HADAMARD"}
    ]
  }
}
