{
  "motif_id": "toffoli_core_param",
  "description": "Toffoli core with any-nonclifford outer phases",
  "source": "hand_crafted",
  "tags": ["toffoli", "parametric"],
  "graph": {
    "nodes": [
      {"id": 0, "vertex_type": "Z", "phase_class": "any_nonclifford", "is_boundary": false},
      {"id": 1, "vertex_type": "Z", "phase_class": "zero", "is_boundary": false},
      {"id": 2, "vertex_type": "Z", "phase_class": "any_nonclifford", "is_boundary": false}
    ],
    "links": [
      {"source": 0, "target": 1, "edge_type": "SIMPLE"},
      {"source": 1, "target": 2, "edge_type": "SIMPLE"}
    ]
  }
}
