{
  "motif_id": "pauli_x_hub_3z",
  "description": "X(pauli) hub connected to 3 Z(zero) spiders",
  "source": "hand_crafted",
  "tags": ["hub", "pauli"],
  "graph": {
    "nodes": [
      {"id": 0, "vertex_type": "X", "phase_class": "pauli", "is_boundary": false},
      {"id": 1, "vertex_type": "Z", "phase_class": "zero", "is_boundary": false},
      {"id": 2, "vertex_type": "Z", "phase_class": "zero", "is_boundary": false},
      {"id": 3, "vertex_type": "Z", "phase_class": "zero", "is_boundary": false}
    ],
    "links": [
      {"source": 0, "target": 1, "edge_type": "SIMPLE"},
      {"source": 0, "target": 2, "edge_type": "SIMPLE"},
      {"source": 0, "target": 3, "edge_type": "SIMPLE"}
    ]
  }
}
