{
  "motif_id": "zz_interaction_param",
  "description": "ZZ interaction with any-nonzero center phase",
  "source": "hand_crafted",
  "tags": ["qaoa", "vqe", "interaction", "parametric"],
  "graph": {
    "nodes": [
      {"id": 0, "vertex_type": "Z", "phase_class": "zero", "is_boundary": false},
      {"id": 1, "vertex_type": "Z", "phase_class": "any_nonzero", "is_boundary": false},
      {"id": 2, "vertex_type": "Z", "phase_class": "zero", "is_boundary": false}
    ],
    "links": [
      {"source": 0, "target": 1, "edge_type": "SIMPLE"},
      {"source": 1, "target": 2, "edge_type": "SIMPLE"}
    ]
  }
}
