{
  "motif_id": "syndrome_extraction",
  "description": "Syndrome extraction fan-out from error correction codes",
  "source": "hand_crafted",
  "tags": ["error_correction", "syndrome"],
  "graph": {
    "nodes": [
      {"id": 0, "vertex_type": "Z", "phase_class": "zero", "is_boundary": false},
      {"id": 1, "vertex_type": "X", "phase_class": "zero", "is_boundary": false},
      {"id": 2, "vertex_type": "X", "phase_class": "zero", "is_boundary": false}
    ],
    "links": [
      {"source": 0, "target": 1, "edge_type": "SIMPLE"},
      {"source": 0, "target": 2, "edge_type": "SIMPLE"}
    ]
  }
}
