{
  "motif_id": "hadamard_sandwich",
  "description": "Clifford Z-spider between two phaseless Z-spiders via H-edges",
  "source": "hand_crafted",
  "tags": ["controlled_phase", "clifford"],
  "graph": {
    "nodes": [
      {"id": 0, "vertex_type": "Z", "phase_class": "zero", "is_boundary": false},
      {"id": 1, "vertex_type": "Z", "phase_class": "zero", "is_boundary": false},
      {"id": 2, "vertex_type": "Z", "phase_class": "clifford", "is_boundary": false}
    ],
    "links": [
      {"source": 0, "target": 2, "edge_type": "HADAMARD"},
      {"source": 2, "target": 1, "edge_type": "HADAMARD"}
    ]
  }
}
