{
  "motif_id": "cluster_chain",
  "description": "Hadamard-edge chain from cluster/graph states",
  "source": "hand_crafted",
  "tags": ["cluster_state", "mbqc"],
  "graph": {
    "nodes": [
      {"id": 0, "vertex_type": "Z", "phase_class": "zero", "is_boundary": false},
      {"id": 1, "vertex_type": "Z", "phase_class": "zero", "is_boundary": false},
      {"id": 2, "vertex_type": "Z", "phase_class": "zero", "is_boundary": false}
    ],
    "links": [
      {"source": 0, "target": 1, "edge_type": "HADAMARD"},
      {"source": 1, "target": 2, "edge_type": "HADAMARD"}
    ]
  }
}
