{
  "motif_id": "hadamard_pauli_pair",
  "description": "Z(zero)-X(pauli) pair via Hadamard edge",
  "source": "hand_crafted",
  "tags": ["pauli", "hadamard"],
  "graph": {
    "nodes": [
      {"id": 0, "vertex_type": "Z", "phase_class": "zero", "is_boundary": false},
      {"id": 1, "vertex_type": "X", "phase_class": "pauli", "is_boundary": false}
    ],
    "links": [
      {"source": 0, "target": 1, "edge_type": "HADAMARD"}
    ]
  }
}
